{"created_block":101,"digest_sha256":"f50cc12a7e6db2743346d54c3c1b7d287607389bbe35057cdc4d983b6353e67b","expires_at_block":106,"netuid":24,"network":"finney","schema":"miss.computer/misscomputer-subnet/weight-plan","schema_version":1,"snapshot":{"block":101,"epoch":5,"finalized":true,"identity_fingerprint":"a27381e4ea7408ebce0f02f84143ea538e860a09a7401e7e6f647d3d60f2f5f9","tempo":20},"validator_hotkey":"validator-hotkey","version_key":2,"weights":[{"hotkey":"miner-b-hotkey","uid":3,"weight":0.6},{"hotkey":"miner-a-hotkey","uid":9,"weight":0.4}]}
